0100014,"宮城日産自動車（株）　カートピア扇町","983-0034","宮城県仙台市宮城野区扇町２−２−１","","022-236-3052","0066-9707-8814","022-236-2324","県内７店のネットワーク！お捜しの車がきっと見つかります。皆様のご来場を心よりお待ちしております。","http://picture1.goo-net.com/shop/010/0100014/L/0100014.jpg","","","","","","","","","9:30-18:15","火曜日","140.943912","38.2687644","E140.56.53.4","N38.15.57.0"
0100027,"松本日産自動車（株）　諏訪カーランド","392-0012","長野県諏訪市四賀赤沼１５１７−１","","0266-52-4320","0066-9708-4709","0266-53-2358","ベテランスタッフが貴方のカーライフをサポート致します。保証・アフター充実!！何でもお気軽にご相談下さい。","http://picture1.goo-net.com/shop/010/0100027/L/0100027.jpg","http://picture1.goo-net.com/shop/010/0100027/L/0100027_Det_1.jpg","http://picture1.goo-net.com/shop/010/0100027/L/0100027_Det_2.jpg","http://picture1.goo-net.com/shop/010/0100027/L/0100027_Det_3.jpg","http://picture1.goo-net.com/shop/010/0100027/L/0100027_Det_4.jpg","展示場には、高品質な中古車が常時約２０台前後を展示しております！","店内にあるＧｅｔ−Ｕ端末から全国約２万台の展示車の中から、お気に入りのお車をお探し頂けます！","気になるお車のご商談から、カーライフのアドバイスまでお気軽にご相談下さい！","県道４８７号線、この看板が目印です！","9:00-19:00","火曜日","138.120943","36.024846","E138.08.8.4","N36.00.0.2"
0100028,"（株）日産サティオ群馬　カーフェスタ伊勢崎","372-0802","群馬県伊勢崎市田中島町１４０６−１０","","0270-24-4600","0066-9706-7865","0270-24-4743","日産中古車ワイド保証で購入後も安心です！北関東自動車道駒形ＩＣより車で１０分！お気軽にご来店下さい！お待ちしております！","http://picture1.goo-net.com/shop/010/0100028/L/0100028.jpg","http://picture1.goo-net.com/shop/010/0100028/L/0100028_Det_1.jpg","http://picture1.goo-net.com/shop/010/0100028/L/0100028_Det_2.jpg","http://picture1.goo-net.com/shop/010/0100028/L/0100028_Det_3.jpg","","伊勢崎地区唯一の日産ディーラー中古車店です","商談棟を中心に約５０台の展示車があります","日産車ならおまかせ下さい","","9:30-19:00","毎週月曜日","139.1689841","36.325084","E139.10.21.1","N36.19.17.7"
0100029,"群馬日産自動車（株）　ゆうタウンＫｉｔ−Ｒ高前","370-0001","群馬県高崎市中尾町４６７番地","","027-361-1423","0066-9706-0165","027-361-0523","車は高額なお買い物です。だから・・・「買うときお得・安心」「乗って安心」の「ゆうタウンＫｉｔ-Ｒ高前」からお選び下さい。","http://picture1.goo-net.com/shop/010/0100029/L/0100029.jpg","http://picture1.goo-net.com/shop/010/0100029/L/0100029_Det_1.jpg","http://picture1.goo-net.com/shop/010/0100029/L/0100029_Det_2.jpg","http://picture1.goo-net.com/shop/010/0100029/L/0100029_Det_3.jpg","http://picture1.goo-net.com/shop/010/0100029/L/0100029_Det_4.jpg","セダン車をお探しの方はこちらへ！","ＲＶ車をお探しの方はこちらへ！","軽自動車・コンパクト車をお探しの方はこちらへ！","セダン車をお選びの方はこちらの商談ルームへ！","平日9:30-19:00 日曜・祝日9:30-18:00","月曜日・第１・第３火曜日","139.0226324","36.3678559","E139.1.32.922","N36.21.52.976"
0100065,"浜松日産自動車（株）　Ｕｃａｒｓ掛川店","436-0043","静岡県掛川市大池６３３−１","","0537-22-3201","0066-9700-2484","0537-22-3205","中古車販売から修理・整備・板金のことまでクルマの事なら当店にてご相談ください。きっと、あなたのお役に立てます。","http://picture1.goo-net.com/shop/010/0100065/L/0100065.jpg","http://picture1.goo-net.com/shop/010/0100065/L/0100065_Det_1.jpg","http://picture1.goo-net.com/shop/010/0100065/L/0100065_Det_2.jpg","http://picture1.goo-net.com/shop/010/0100065/L/0100065_Det_3.jpg","http://picture1.goo-net.com/shop/010/0100065/L/0100065_Det_4.jpg","店舗は国道１号線沿い「焼肉やさかい」さん隣です。","カタログはもちろん、マンガにテレビもありますよ！ごゆっくりおくつろぎください！！","お子様用キッズコーナーも、もちろん完備！パパもママも安心です！","豊富なドリンクメニューでおもてなし！ココアやコーンポタージュもありますよ！","9:30-19:00","水曜日・第1火曜日","137.9896909","34.7748549","E137.59.34.0","N34.46.17.6"
0100030,"（株）日産サティオ群馬　カーフェスタ高崎","370-0071","群馬県高崎市小八木町１６８２","","027-361-2323","0066-9700-3075","027-361-2324","ご来場プレゼント実施中！是非この機会にご来場下さい。素敵なプレゼントと特選車をご用意してお待ちしております！！","http://picture1.goo-net.com/shop/010/0100030/L/0100030.jpg","http://picture1.goo-net.com/shop/010/0100030/L/0100030_Det_1.jpg","http://picture1.goo-net.com/shop/010/0100030/L/0100030_Det_2.jpg","http://picture1.goo-net.com/shop/010/0100030/L/0100030_Det_3.jpg","","広い展示場でゆっくりとご覧ください。駐車場も広くじゅうぶんございます。","商談コーナーお飲み物・雑誌・カタログ等、おくつろぎください。","キッズコーナーです。安心してお子様とお出かけください。","","9:30−19:00","毎週月曜日","139.0198549","36.3654199","E139.01.23.1","N36.21.44.2"
